,id,title,author,day,genre,platform,story,age,rate,free,complete,thumbnail,web
0,0,마물전담부대,염손,0,"스토리, 판타지",네이버 웹툰,"마법혁명으로 근대화를 이룬 판타지 세계.
하지만 이러한 세계에서도 마물은 여전히 인류를 위협하는 요소였고,
이를 위해 각 국가는 마물 퇴치를 위한 조직 &lt;마물전담부대&gt;를 조직한다.

평범한 소시민이었던 리건은 엉겁결에 &lt;마물전담부대&gt;에 입대하게 되고,
여기서 열심히 구르며 고생하는 리건의 이야기가 시작된다.
본의 아니게 입대를 하게 되었지만 신입 부대원은 자신 한명 뿐이었고,
선임들의 집중교육과 목숨이 오가는 전투 속에서 리건은 점점 강해진다.
하지만 리건이 상대하는 마물 역시 만만치 않은 존재이기에
리건은 눈물 겨운 사투는 계속 이어진다…!",0,9.11,2,1,https://shared-comic.pstatic.net/thumb/webtoon/773644/thumbnail/thumbnail_IMAG06_4ac041cd-6275-4034-afd7-7a241e61eb51.jpg,https://comic.naver.com/webtoon/list?titleId=773644
1,1,불릿,김도근,0,"스토리, 스포츠",네이버 웹툰,"축구부 에이스, 좋아하는 선배에게 고백하려 했는데... 에어소프트 게임 마스터가 된다?!",0,9.89,1,1,https://shared-comic.pstatic.net/thumb/webtoon/738843/thumbnail/thumbnail_IMAG06_2cffd372-4e4d-4800-bbc0-71fd8ac16992.jpg,https://comic.naver.com/webtoon/list?titleId=738843
2,2,더,공현곤,0,"스토리, 스릴러",네이버 웹툰,수천년 전 조상들의 경주로 정해진 12인의 운명. 자리를 지키려는 1등과 바꾸려는 12등의 살벌한 대결!,15,9.94,1,1,https://shared-comic.pstatic.net/thumb/webtoon/747637/thumbnail/thumbnail_IMAG06_41a9c63d-642f-43df-b25f-27bfe8548e01.jpg,https://comic.naver.com/webtoon/list?titleId=747637
3,3,각자의,오묘,0,"스토리, 로맨스",네이버 웹툰,"헤어졌지만 헤어지지 않은 사이
솔직하지 못한 우리들 어떻게 될까요?",0,9.97,1,1,https://shared-comic.pstatic.net/thumb/webtoon/749055/thumbnail/thumbnail_IMAG06_b1e0caa9-f3b9-4a03-8efb-5e2551b81945.jpg,https://comic.naver.com/webtoon/list?titleId=749055
4,4,노선도,효기,0,"스토리, 스릴러",네이버 웹툰,"암호화폐 투자 실패로 모든 걸 잃은 평범한 40대 회사원 '권한수'.
절망한 그의 앞에 우연히 현금 20억이 든 황금색 캐리어가 나타나지만,
오히려 점점 더 깊은 함정에 빠지고 만다.",15,9.82,1,1,https://shared-comic.pstatic.net/thumb/webtoon/745473/thumbnail/thumbnail_IMAG06_fab4a0af-e819-4588-b32d-724c67a6353c.jpg,https://comic.naver.com/webtoon/list?titleId=745473
5,5,말하는대로,무브,0,"스토리, 드라마",네이버 웹툰,"꿈도 목표도 없이 하루하루를 살아가던 평범한 고등학교 3학년생 주현. 
어느 날부터 갑자기 그녀가 말하는 모든 것들이 실제로 이루어지게 된다.
특별한 능력을 가지게 되었지만, 그만큼 말하는 것이 편하지만은 않은데... 
그녀의 평범하고 반복적이던 일상이 조금씩 뒤틀리기 시작한다!",0,9.9,1,1,https://shared-comic.pstatic.net/thumb/webtoon/761596/thumbnail/thumbnail_IMAG06_1f42932d-6ffa-440d-ab80-6abf18840928.jpg,https://comic.naver.com/webtoon/list?titleId=761596
6,6,연주동,후던잇,0,"스토리, 스릴러",네이버 웹툰,"프로파일러가 되고 싶은 평범한 고3 권성찬.
고등학교 졸업 후 대학을 안 가겠다 선언해 부모님과 크게 갈등한다.

늦게 하교하며 가족들과 냉랭하게 지내던 어느 비 오는 밤,
성찬의 집에서 일가족이 살해당하는 사건이 발생하게 되는데 성찬의 손에 흉기가 들려 있다.

현장에서 바로 잡혀간 성찬은 본인의 누명을 벗고, 살인사건의 진실을 파헤치기 위해 가족의 흔적을 추적해간다.
성찬은 몰랐던 가족들의 모습을 알아가며 진범을 잡을 실마리를 하나씩 풀게 된다.",0,9.58,2,1,https://shared-comic.pstatic.net/thumb/webtoon/773648/thumbnail/thumbnail_IMAG06_0110cb5a-a9bb-40f5-9a11-581c6620afe5.jpg,https://comic.naver.com/webtoon/list?titleId=773648
7,7,의도적,보민,0,"스토리, 스릴러",네이버 웹툰,"미지의 바이러스 창궐 
극한의 상황 속에서 펼쳐지는 
그들의 의도적인 외면",0,9.57,2,1,https://shared-comic.pstatic.net/thumb/webtoon/773650/thumbnail/thumbnail_IMAG06_48c275ab-3ad5-4f0c-a0cd-d058b3dc3e22.jpg,https://comic.naver.com/webtoon/list?titleId=773650
8,8,맘마미안,미티 / 구구,0,"스토리, 드라마",네이버 웹툰,"아들보다 어려진 엄마?!
다 큰 아들의 목숨을 건 엄마 뒷바라지!",12,9.96,1,1,https://shared-comic.pstatic.net/thumb/webtoon/729326/thumbnail/thumbnail_IMAG06_f0d1872a-5d19-4038-ba8a-2a831beb36e9.jpg,https://comic.naver.com/webtoon/list?titleId=729326
9,9,로맨스는,박시현 / 라미아,0,"스토리, 로맨스",네이버 웹툰,무자비한 킬러 '사냥개' 현주와 순수한(?) 마약판매상 정우가 펼치는 액션로맨스코미디.,0,9.12,2,1,https://shared-comic.pstatic.net/thumb/webtoon/773645/thumbnail/thumbnail_IMAG06_d1a7ab50-3429-4844-bfb3-ace92fcd751c.jpg,https://comic.naver.com/webtoon/list?titleId=773645
10,10,대디고라운드,희나리,0,"스토리, 드라마",네이버 웹툰,"승미는 어렸을 때 부모님이 이혼한 뒤 연락이 끊긴 아빠, 민석을 우연히 다시 만나게 된다.
그 동안 잊고 지냈던 아빠라는 사람에 대한 호기심 때문에 적극적으로 친해지려 노력하는 승미. 
하지만 새로 만난 아빠에게서 전형적인 아버지상은 찾아볼 수 없다. 
이런 저런 이유로 오해가 생기기도 하고 서운한 감정도 생기지만 왠지 아빠와 지내는 시간들이 즐겁고 행복하다.",0,8.27,2,1,https://shared-comic.pstatic.net/thumb/webtoon/773640/thumbnail/thumbnail_IMAG06_7567e702-bbab-4f61-94b8-bea6ac46792e.jpg,https://comic.naver.com/webtoon/list?titleId=773640
11,11,도리내리,사영,0,"스토리, 로맨스",네이버 웹툰,"신선의 인간 제자 사화는 변신술을 다루는 귀(鬼)인 다루를 만난다.
그와의 만남을 통해 사화는 자신을 소망을 깨닫고 진정한 인간의 삶을 살고 싶다며 스승인 백화 신선에게 간청하고,
스승은 사화에게 일어날 어떤 일을 짐작하고 이를 허락한다.
때마침 황궁에서 인재를 뽑는다는 방이 마을에 붙고,
사화는 가온이라는 사내와 함께 섬을 벗어나 황궁으로 가는 배에 올라타는데….",0,9.72,2,1,https://shared-comic.pstatic.net/thumb/webtoon/773643/thumbnail/thumbnail_IMAG06_6b81a90a-5174-4754-b1cc-505bc4c99fc5.jpg,https://comic.naver.com/webtoon/list?titleId=773643
12,12,아내를,희나리,0,"스토리, 스릴러",네이버 웹툰,"친구와 술을 마신 후 곯아떨어진 ‘정호’는 숙취로 눈을 뜬 다음 날 아침,
 별거 중이던 아내 ‘미영’이 살해당했다는 충격적인 소식을 듣게 된다. 
그 순간, 자신의 옷에 묻은 핏자국과 피 묻은 칼을 발견한 ‘정호’.
 가장 강력한 용의자로 지목된 그는 경찰의 눈을 피해 도망친다.
알리바이를 입증하고 싶지만 전날의 술로 인해 필름이 끊겨 있는 정호는, 
부분부분 떠오르는 기억의 조각들을 붙잡고, 또 어젯밤같이 술을 마신 친구를 
비롯한 다른 주변 인물들의 진술을 토대로 자신의 어제 행방을 추적하면서 무죄를 입증하려 한다. 
그런데 자신의 기억과 주변의 이야기들을 조각조각 맞추다 보니 
정말 내가 아내를 죽였을지도 모른다 라는 생각에 이르게 된다.  
&lt;아내를 죽였다&gt;는 숙취 가득한 정호가 누명을 벗기 위해 또한 
아내의 죽음을 둘러싼 진실을 파헤치기 위해 죽을 힘을 다하는 하루 동안의 현재 이야기와 
정호와 아내 미영이 별거까지 갈 수 밖에 없었던 그의 어두운 과거 이야기가 두 개의 축으로 엮이면서 
이 사건의 진실에 접근해가는 구성으로 끝까지 긴장감을 유지하며 충격적인 결말까지 이어진다. 
2019년 이시언 주연의 영화로 개봉, 호평을 받았다.",0,9.41,2,1,https://shared-comic.pstatic.net/thumb/webtoon/772005/thumbnail/thumbnail_IMAG06_c23c5040-93e7-471b-9754-f2f93e0fb5a6.jpg,https://comic.naver.com/webtoon/list?titleId=772005
13,13,오늘또오늘,희나리,0,"스토리, 드라마",네이버 웹툰,"헤어진 여자친구로부터 넘겨받은 부채로 인해 하루 아침에 완전히 꼬이는 인생을 살게 되는 용수.
사채업자의 압력에서 벗어나고자 고군분투하던 중, 마침 찾아온 장마철.
용수는 수재민 모금 비디오를 찍어 일확천금을 꿈꾼다.
친구 진태와 사채업자 봉팔까지 합세하여 이 새로운 사업에 매진하게 된다.
처음엔 잘 나가는 듯해 보이던 이 사업은, 장마가 그침으로써 망하게 되고, 
용수들은 더 큰 빚더미에 앉게 된다.

그 뒤로 새로운 모금 아이템을 찾아 계속적인 모금 비디오를 만들지만 
양심의 가책과 경찰 수사망에 쫓기는 신세가 되어 버린 용수들.
그 속에서 그의 진심을 알아주는 단 한 명의 여자, 정아와의 로맨스.
그러나, 결국 용수들은 그들의 무거운 양심의 짐을 벗고 참회하는 방법을 택하게 된다.",0,9.07,2,1,https://shared-comic.pstatic.net/thumb/webtoon/773642/thumbnail/thumbnail_IMAG06_712f8564-1453-4662-96be-7767706e49ff.jpg,https://comic.naver.com/webtoon/list?titleId=773642
14,14,토끼대왕,김숭늉,0,"스토리, 스릴러",네이버 웹툰,"살인마 교생, 왕따를 구원하다.",18,9.92,1,1,https://shared-comic.pstatic.net/thumb/webtoon/742826/thumbnail/thumbnail_IMAG06_56b8a37c-93c4-4db5-9946-a96f6067cded.jpg,https://comic.naver.com/webtoon/list?titleId=742826
15,15,복학생,한짜장,0,"스토리, 드라마",네이버 웹툰,"22살 정순이가 춘장 고등학교에 복학을 한다. 
무덤덤한 자연인 순이에게 관심을 보이는 중2병 친구들. 
과연 순이는 고등학교를 무사히 마무리할 수 있을까?",12,9.96,1,1,https://shared-comic.pstatic.net/thumb/webtoon/735243/thumbnail/thumbnail_IMAG06_188eb47c-0c03-4164-8f99-09fa0474948a.jpg,https://comic.naver.com/webtoon/list?titleId=735243
16,16,살人스타그램,령,0,"옴니버스, 스릴러",네이버 웹툰,"[SNS 잔혹 스릴러 시즌2]
귀신마피아게임에 초대되었습니다.
플레이어 중에 사람을 죽이는 귀신이 숨어있습니다. 누구일까요? 투표를 시작하겠습니다. 5,4,3,2...1.",18,9.61,1,1,https://shared-comic.pstatic.net/thumb/webtoon/726095/thumbnail/thumbnail_IMAG06_61503b0e-4f1b-4b52-bca4-486f1b567ea9.jpg,https://comic.naver.com/webtoon/list?titleId=726095
17,17,당신의,호우,0,"옴니버스, 드라마",네이버 웹툰,"향기를 타고 잊지 못하는 순간으로 다시 한 번 돌아갈 수 있다면? 
그리운 순간의 향기를 향수로 만드는 조향사 J와 그 향기에 이끌려 찾아오는 손님들의 이야기. 당신의 향수.",0,9.98,1,1,https://shared-comic.pstatic.net/thumb/webtoon/741150/thumbnail/thumbnail_IMAG06_2a45b933-b081-4191-8696-ef6b37c00920.jpg,https://comic.naver.com/webtoon/list?titleId=741150
18,18,스몰,을승,0,"스토리, 로맨스",네이버 웹툰,"네 앞에 서면 왜 난 자꾸...♡
좋아하는 이성과 함께 있으면 
자꾸만 작아지는 것 같은 기분, 한 번쯤 다들 경험해 봤지? 
문제는 정말 몸까지 줄어든다구!",0,9.93,1,1,https://shared-comic.pstatic.net/thumb/webtoon/745236/thumbnail/thumbnail_IMAG06_71142cf6-f23b-4567-a088-143fe375a4ec.jpg,https://comic.naver.com/webtoon/list?titleId=745236
19,19,도를,이건 / 요엘,0,"스토리, 판타지",네이버 웹툰,"전래동화가 이렇게 꼬인다고? 제대로 약빤(?) 동화가 시작된다!
전우치의 장손, 전우진의 신입 도사 도전기",12,9.9,1,1,https://shared-comic.pstatic.net/thumb/webtoon/747666/thumbnail/thumbnail_IMAG06_4a42e7f5-6dc3-443d-b394-7a59f9a0efdc.jpg,https://comic.naver.com/webtoon/list?titleId=747666
20,20,불티,박시현 / 오른손,0,"스토리, 스릴러",네이버 웹툰,"화학약품이나 폭발물을 제조해 사기, 협박 등을 하며 살고 있는 봉준. 
타깃으로 삼았던 건물이 폭발해버리고, 영문도 모른 채 연쇄 폭탄 테러범이라는 누명을 쓰고 만다.",0,9.46,2,1,https://shared-comic.pstatic.net/thumb/webtoon/772002/thumbnail/thumbnail_IMAG06_560d98b9-aff7-465d-a63f-8f7d4a023ba9.jpg,https://comic.naver.com/webtoon/list?titleId=772002
21,21,제7원,남정훈 / 김태헌,0,"스토리, 스릴러",네이버 웹툰,"‘낯 선 감방에서 눈을 뜬 남자 4310. 
그는 자신이 기억을 잃었다는 것과 아울러 이 감방엔 문이 없는 사방이 벽뿐이라는 사실을 알게 된다!’",0,9.29,2,1,https://shared-comic.pstatic.net/thumb/webtoon/772004/thumbnail/thumbnail_IMAG06_645bc3fd-6ef5-49ff-b4bd-3b978d7be1b7.jpg,https://comic.naver.com/webtoon/list?titleId=772004
22,22,DEY,DEY,0,"옴니버스, 스릴러",네이버 웹툰,"[데드데이즈] DEY작가의 새로운 공포 단편선
기발하고 소름 돋는 무서운 이야기들로 만들어 낸 실험적인 옴니버스 공포웹툰.",18,9.8,2,1,https://shared-comic.pstatic.net/thumb/webtoon/774762/thumbnail/thumbnail_IMAG06_9bed69dd-025e-4d8b-90d1-b2bf34604347.jpg,https://comic.naver.com/webtoon/list?titleId=774762
23,23,금혼령-조선혼인금지령,천지혜 / 산책,0,"스토리, 로맨스",네이버 웹툰,"7년째 이어진 조선혼인금지령?!
왕을 상대로 한 인생 사기극",15,9.96,1,1,https://shared-comic.pstatic.net/thumb/webtoon/729938/thumbnail/thumbnail_IMAG06_4c3a8161-1d55-4116-abdd-8a21ead342a0.jpg,https://comic.naver.com/webtoon/list?titleId=729938
24,24,재혼,"알파타르트,히어리 / 숨풀",0,"스토리, 로맨스",네이버 웹툰,"동대제국의 완벽한 황후였던 나비에.
?황제인 남편이 정부를 황후로 만들려는 것을 알고 이혼을 택한다. 그리고 결심한다.
이곳에서 황후가 될 수 없다면 다른 곳에서 황후가 되겠다고.
인기 웹소설 &lt;재혼 황후&gt;가 웹툰화되다!",12,9.97,1,1,https://shared-comic.pstatic.net/thumb/webtoon/735661/thumbnail/thumbnail_IMAG06_1f38280a-63d8-4cb5-a6f8-de828c4d914c.jpg,https://comic.naver.com/webtoon/list?titleId=735661
25,25,당신의,고태호,0,"스토리, 드라마",네이버 웹툰,"모든 것을 잃어버린 17년. 그래도 아직... 살아있다.
나를 살인자라 손가락질한 당신들은... 무죄입니까?",15,9.96,1,1,https://shared-comic.pstatic.net/thumb/webtoon/738194/thumbnail/thumbnail_IMAG06_4673d022-2115-4312-b963-d5dd0a3dcfe7.jpg,https://comic.naver.com/webtoon/list?titleId=738194
26,26,늑대가,김민희,0,"스토리, 드라마",네이버 웹툰,"엄마의 재혼을 창의적으로 반대하다 깡촌의 대안학교로 쫓겨난 사고뭉치 금수저 김순한. 
알고 보니 대안 학교 '두손고'의 친구들은 모두 늑대인간?!",0,9.8,2,1,https://shared-comic.pstatic.net/thumb/webtoon/771993/thumbnail/thumbnail_IMAG06_1b4664e6-c974-4ecc-be10-8987ead63069.jpg,https://comic.naver.com/webtoon/list?titleId=771993
27,27,흥부놀부전,황동,0,"스토리, 판타지",네이버 웹툰,"전래동화 흥부놀부 이후. 다시 제비를 쫓아가는 흥부와 놀부의 목적은 복수?! 
한국 전래동화의 기록되지 않은 후일담(?)을 다룬 열혈 무협 판타지 액션물!",0,9.58,2,1,https://shared-comic.pstatic.net/thumb/webtoon/772001/thumbnail/thumbnail_IMAG06_0fc0a367-1d81-4641-b0d3-edcc83f5947c.jpg,https://comic.naver.com/webtoon/list?titleId=772001
28,28,죽여주는,뻥 / 조은,0,"스토리, 스릴러",네이버 웹툰,"타인의 거짓말을 꿰뚫어보는 고교생 백아. 
거짓으로 사건을 만들어내는 탐정을 만나고, 
세상에 그의 진실을 밝혀내야 한다.",12,9.9,1,1,https://shared-comic.pstatic.net/thumb/webtoon/744313/thumbnail/thumbnail_IMAG06_80181352-8a14-4c52-b9d9-70633cbafa53.jpg,https://comic.naver.com/webtoon/list?titleId=744313
29,29,뫼신,윤현승 / 방승현,0,"스토리, 판타지",네이버 웹툰,"신령과도 같은 짐승 뫼신.
떠돌이 무사 한세희는 그들을 사냥하고, 
그의 앞에 신비한 힘을 가진 소녀가 나타나는데...",15,9.92,1,1,https://shared-comic.pstatic.net/thumb/webtoon/751208/thumbnail/thumbnail_IMAG06_ff8db46b-2512-41d9-92be-2287f42ada88.jpg,https://comic.naver.com/webtoon/list?titleId=751208
30,30,셈하는,면지,0,"스토리, 로맨스",네이버 웹툰,"사람의 마음을 1에서 100까지의 '숫자'로 볼 수 있는 권모란.
괴상한 능력을 없애기 위한 파란만장 고교생활이 시작된다!",0,9.97,1,1,https://shared-comic.pstatic.net/thumb/webtoon/738173/thumbnail/thumbnail_IMAG06_d273ffbd-c107-4cd6-b949-549459ba1994.jpg,https://comic.naver.com/webtoon/list?titleId=738173
31,31,"소년,",수진,0,"스토리, 로맨스",네이버 웹툰,"한번 사귀면 한 달 동안만 사귀어 '한달동'이라 불리는 한재동.
진짜 사랑을 믿지 않던 그에게 사랑이 찾아왔다.",0,9.68,2,1,https://shared-comic.pstatic.net/thumb/webtoon/771990/thumbnail/thumbnail_IMAG06_616bda46-c0c7-4096-927c-2dcfae1e09f5.jpg,https://comic.naver.com/webtoon/list?titleId=771990
32,32,줄라이,신건우,0,"스토리, 로맨스",네이버 웹툰,"아이돌과 합주 팀원이 되야 한다고?!
한국예술대학교 실용음악과에 재학중인 여주 한주리.
?주리는 합주 시간에 팀원을 구하지 못하게 되고 기숙사에서 쫒겨날 판에 쳐하게 된다.
?기숙사에서 쫒겨나지 않으려면 팀을 구해야 하는데...
?남은 사람은 아이돌스타 블루?",0,6.88,2,1,https://shared-comic.pstatic.net/thumb/webtoon/771992/thumbnail/thumbnail_IMAG06_049fe3db-3a35-4a2c-864b-fa6f7d8c0bc6.jpg,https://comic.naver.com/webtoon/list?titleId=771992
33,33,하슬라,까를로스 / 유상진,0,"스토리, 액션",네이버 웹툰,"일곱 번 타인의 삶을 구하면 한 번의 살인이 무죄가 되는 도시 하슬라.
처절한 복수를 꿈꾸는 도진. '피의 도시' 하슬라에서 사마리안이 되다.",15,9.91,1,1,https://shared-comic.pstatic.net/thumb/webtoon/730391/thumbnail/thumbnail_IMAG06_c2b041ab-ab07-4a42-a782-5eb88581088b.jpg,https://comic.naver.com/webtoon/list?titleId=730391
34,34,합격시켜주세용휴재,이온,0,"스토리, 판타지",네이버 웹툰,"천년째 용이 되려는 수험생 바리와
전설의 과외선생 찬영이의 낙동강 용 합격 수기",0,9.98,2,1,https://shared-comic.pstatic.net/thumb/webtoon/728128/thumbnail/thumbnail_IMAG06_a694ef92-520b-4767-89f5-3f0ae2cef5d8.jpg,https://comic.naver.com/webtoon/list?titleId=728128
35,35,감히,희나리,0,"스토리, 스릴러",네이버 웹툰,"진실을 향한 입과 귀를 틀어막고 짓누르는 그들. 
이제 죽음에서 자유로워진 그녀의 복수가 시작된다.",15,9.91,1,1,https://shared-comic.pstatic.net/thumb/webtoon/738177/thumbnail/thumbnail_IMAG06_dc62877b-7255-460f-aab8-0045ea90850f.jpg,https://comic.naver.com/webtoon/list?titleId=738177
36,36,인터셉트,임주이,0,"에피소드, 로맨스",네이버 웹툰,"비 오는 날이면 늘 안 좋은 일만 생기던 그녀에게 처음으로 내린 따스한 비.
사랑에 지친 윤서에게 새로운 사랑이 찾아온다!",0,9.94,2,1,https://shared-comic.pstatic.net/thumb/webtoon/747961/thumbnail/thumbnail_IMAG06_3d8af28c-f88b-4a13-b564-71a3ae56df62.jpg,https://comic.naver.com/webtoon/list?titleId=747961
37,37,별종,이무기,0,"스토리, 드라마",네이버 웹툰,"이방인이 지구에 방문했다.
불행은 그 때부터 시작되었다.
예측불허 전개의 SF 스릴러.",15,9.94,1,1,https://shared-comic.pstatic.net/thumb/webtoon/738144/thumbnail/thumbnail_IMAG06_6fa6e0e3-9111-41bf-91ef-4b7289fbd4d8.jpg,https://comic.naver.com/webtoon/list?titleId=738144
38,38,지금은,자유,0,"스토리, 로맨스",네이버 웹툰,"주인공 하얀은 고고학과 2학년. 
어릴 적 꿈을 좇아 고고학과에 입학했지만 상상과는 다른 전공 내용, 취업 등의 
현실적인 문제 때문에 전과해야 하는 것은 아닌지 계속 고민 중이다.
 그러던 중 하얀은 뜻밖에도 우리나라의 고대사를 뒤엎을 만한 
역사적 유물 조사의 연구 장학생으로 선택되면서 다시 한 번 고고학에 대한 열정을 불태우기로 하는데...",0,9.85,2,1,https://shared-comic.pstatic.net/thumb/webtoon/771988/thumbnail/thumbnail_IMAG06_9d9a607e-402f-4070-a9d7-f625db8f4a5f.jpg,https://comic.naver.com/webtoon/list?titleId=771988
39,39,알바걸과,수진,0,"스토리, 드라마",네이버 웹툰,"집안 사정으로 휴학을 한 미대생 '나탈리'.
그녀는 낮에는 빵집, 밤에는 편의점 알바를 한다.
그런 그녀 앞에 동네 백수 일명 워킹(walking)맨 '주드로'가 나타난다.",0,9.72,2,1,https://shared-comic.pstatic.net/thumb/webtoon/771989/thumbnail/thumbnail_IMAG06_5cf016df-024f-4abe-8cc3-41bfbdcb2056.jpg,https://comic.naver.com/webtoon/list?titleId=771989
40,40,피플,서승준 / 손창균,0,"스토리, 드라마",네이버 웹툰,"평범한 삶을 원하는 선장과 선원들.
바다 한 가운데서 펼쳐지는 그들의 긴박한 이야기.",12,9.82,1,1,https://shared-comic.pstatic.net/thumb/webtoon/706590/thumbnail/thumbnail_IMAG06_3dcabf9a-4afd-48c0-b375-d2c0f8ec576b.jpg,https://comic.naver.com/webtoon/list?titleId=706590
41,41,뱀파이어의,카나리아 / 동물,0,"스토리, 로맨스",네이버 웹툰,"500년 만에 인간 세상에 나타난 뱀파이어, 루베르이와 인간 계약자 서영의
'뱀파이어 꽃'을 찾는 숨 막히는 모험과 사랑을 그린 뱀파이어 로맨스.
※본 작품은 시리즈 오리지널 작품으로 네이버웹툰에서 듀얼연재됩니다.※",12,9.86,2,1,https://shared-comic.pstatic.net/thumb/webtoon/721455/thumbnail/thumbnail_IMAG06_9c5e3329-1733-40b5-887d-7487b61598e2.jpg,https://comic.naver.com/webtoon/list?titleId=721455
42,42,인간의,이재익 / 양세준,0,"스토리, 드라마",네이버 웹툰,"형사와 기자 그리고 이상한 소년.
일어나선 안 될 사건들.
진실을 향한 치열한 추적이 시작된다.",15,9.91,1,1,https://shared-comic.pstatic.net/thumb/webtoon/733770/thumbnail/thumbnail_IMAG06_3fb82c49-9078-41bd-a19d-74e35c5fbcff.jpg,https://comic.naver.com/webtoon/list?titleId=733770
43,43,미스테리,고경빈,0,"스토리, 스릴러",네이버 웹툰,"인간들은 내 장난감이야. 난 인간들이 좋아.
불가사의한 존재들, 그리고 그들이 보여주는 ""당신이 가장 아름답게 빛나는 순간.""",0,9.68,2,1,https://shared-comic.pstatic.net/thumb/webtoon/770386/thumbnail/thumbnail_IMAG06_1884257d-229f-43e5-8652-81d98f1b4d96.jpg,https://comic.naver.com/webtoon/list?titleId=770386
44,44,유니버스,고경빈,0,"스토리, 스릴러",네이버 웹툰,"단지 지루하다는 이유로 999개의 평행우주를 창조한 미지의 존재 001.
001이 안내하는 기묘한 세계들의 기묘한 이야기들.",0,9.72,2,1,https://shared-comic.pstatic.net/thumb/webtoon/770387/thumbnail/thumbnail_IMAG06_103197d0-d67a-4402-b7ee-157f5ed58153.jpg,https://comic.naver.com/webtoon/list?titleId=770387
45,45,바이러스X,준 / 하랑,0,"스토리, 스릴러",네이버 웹툰,"사망률 100%의 바이러스의 출현으로 초토화가 된 인류, 
감염 경로도 모른 채 백신을 기다리는 사람들...
이 파국의 끝은 어디인가?!!",15,7.22,2,1,https://shared-comic.pstatic.net/thumb/webtoon/754781/thumbnail/thumbnail_IMAG06_7126c6dc-7ed0-4cf0-80ac-62928bcf1a8c.jpg,https://comic.naver.com/webtoon/list?titleId=754781
46,46,민간인,OSIK,0,"스토리, 스릴러",네이버 웹툰,"GP 그 이면에 감춰져있던 차마 말하지 못했던 이야기들. 
진실은 감출수록 좋다.",15,9.95,2,1,https://shared-comic.pstatic.net/thumb/webtoon/737377/thumbnail/thumbnail_IMAG06_555328ec-96c2-444d-b637-8f6ea79f2691.jpg,https://comic.naver.com/webtoon/list?titleId=737377
47,47,꼬리,진하 / 헤폰,0,"스토리, 로맨스",네이버 웹툰,"""나무꾼의 환생과 결혼하지 않으면 여우가 된다고?!!""
운명의 상대를 찾기 위한 윤하의 고군분투 연애담이 시작된다.",0,9.93,2,1,https://shared-comic.pstatic.net/thumb/webtoon/741894/thumbnail/thumbnail_IMAG06_48bd360a-62a8-4655-b766-1bf84c37569a.jpg,https://comic.naver.com/webtoon/list?titleId=741894
48,48,전자오락수호대,가스파드,0,"스토리, 판타지",네이버 웹툰,"아무도 모르게 게임을 굴리는 비밀의 일꾼들.
최고 요원 패치의 게임 조난 굴곡사!",0,9.97,2,1,https://shared-comic.pstatic.net/thumb/webtoon/637931/thumbnail/thumbnail_IMAG06_a00dcf02-989d-49ca-b267-a8da6208e0d0.jpg,https://comic.naver.com/webtoon/list?titleId=637931
49,49,필살VS로맨스,구르,0,"스토리, 개그",네이버 웹툰,"무협 만화 같은 여자 ‘유비’. 순정 만화 같은 남자 ‘신우’.
자신의 장르대로 살아가던 두 사람의 순탄치 않은 썸타기!
만화의 정석대로 해피엔딩을 이룰 수 있을까?!",0,9.98,2,1,https://shared-comic.pstatic.net/thumb/webtoon/745207/thumbnail/thumbnail_IMAG06_77574f49-7c80-4d31-a648-4eb4a33ac56b.jpg,https://comic.naver.com/webtoon/list?titleId=745207
50,50,혼신,임리나,0,"스토리, 판타지",네이버 웹툰,원귀를 성불시키기 위해 신으로부터 선택받은 ‘사도’와 그러한 사도를 감시하며 보좌하는 ‘감시자’들,0,9.62,2,1,https://shared-comic.pstatic.net/thumb/webtoon/769688/thumbnail/thumbnail_IMAG06_266e7fb6-3295-4df5-a1da-0563d6e04ef5.jpg,https://comic.naver.com/webtoon/list?titleId=769688
