,id,title,author,day,genre,platform,story,age,rate,free,complete,thumbnail,web
1134,143,일렉시드,손제호 / 제나,수,"스토리, 액션",네이버 웹툰,"&lt;노블레스&gt; 손제호 작가와 &lt;소녀더와일즈&gt; 제나 작가가 만났다!
고양이 몸에 깃든 각성자 카이든과 각성능력을 숨겨온 고등학생 지우 
러블리 2인조의 액션 판타지",12,9.79,1,0,https://shared-comic.pstatic.net/thumb/webtoon/717481/thumbnail/thumbnail_IMAG06_8704285d-59f7-446b-8707-8aa3a8b4f647.jpg,https://comic.naver.com/webtoon/list?titleId=717481&amp;weekday=wed
1135,144,나쁜사람,둠스,수,"에피소드, 개그",네이버 웹툰,"착한 남자가 좋다는 그녀의 이상형이 되기 위해 10년 동안 노력했다. 
그런데! 갑자기 나쁜 남자가 좋다는 그녀...

오늘부터 난... 나쁜 남자로 다시 태어난다.",12,9.84,1,0,https://shared-comic.pstatic.net/thumb/webtoon/750184/thumbnail/thumbnail_IMAG06_f1f115ca-4fe2-4df0-a8cf-e1a62b80c866.jpg,https://comic.naver.com/webtoon/list?titleId=750184&amp;weekday=wed
1136,145,블랙홀과 3만원,김규삼 / 혜원,수,"스토리, 개그",네이버 웹툰,"지구멸망 한달 전, 블랙홀에 빨려들어가 얄짤없이 망하게 생긴 인류. 
노스트라 생명에서 인류를 구원할 보험을 출시했다!
블랙홀로 인한 모든 피해를 단돈 3만원에 ㅇㅋ?!
노스트라의 마지막 히트상품과 함께 나타난 이놈들, 과연 구세주인가 바보들인가.",0,9.9,1,0,https://shared-comic.pstatic.net/thumb/webtoon/775690/thumbnail/thumbnail_IMAG06_4e45ed0b-4fb3-4589-849b-71202f895b42.jpg,https://comic.naver.com/webtoon/list?titleId=775690&amp;weekday=wed
1137,146,연놈,상하,수,"스토리, 드라마",네이버 웹툰,"중2 여름, 가지 말라는 말도 좋아했다는 말도 하지 못한 채 보낸 그녀가 3년 만에 나타났다.
지나버린 시간과 마주한 소년 그리고 소녀의 이야기",12,9.85,1,0,https://shared-comic.pstatic.net/thumb/webtoon/667573/thumbnail/thumbnail_IMAG06_a5e67e5d-d884-48f5-a298-260b4ad76297.jpg,https://comic.naver.com/webtoon/list?titleId=667573&amp;weekday=wed
1138,147,고삼무쌍,B급달궁 / 하마,수,"스토리, 액션",네이버 웹툰,"천년간 사라진 무림이 현대 고등학교를 배경으로  되살아난다!
무림인들의 고교습격! 
장르파괴 무협학원액션",15,9.91,1,0,https://shared-comic.pstatic.net/thumb/webtoon/728126/thumbnail/thumbnail_IMAG06_20859a5d-bf0b-431d-bbdf-c8ab3cf409e6.jpg,https://comic.naver.com/webtoon/list?titleId=728126&amp;weekday=wed
1139,148,닥터앤닥터 육아일기,닥터베르,"수, 일","에피소드, 일상",네이버 웹툰,"산부인과 의사 엄마의 임신과 출산, 공학박사 아빠의 논문 기반 육아.
완벽할 것만 같은 이들의 앞길은 과연 순탄할까?
탄탄대로를 달리던 두 사람의 좌충우돌, 우여곡절 중구난방 육아 이야기!
웃다 울고, 울다가 웃게 되는 최고의 항문용 발모제툰!",0,9.96,1,0,https://shared-comic.pstatic.net/thumb/webtoon/732955/thumbnail/thumbnail_IMAG06_72a5df99-22fd-4332-98ed-fd742b64b041.jpg,https://comic.naver.com/webtoon/list?titleId=732955&amp;weekday=wed
1140,149,66666년 만에 환생한 흑마법사,"타루, 화봉 / 파사",수,"스토리, 판타지",네이버 웹툰,"강대했던 흑마법사 디아블로 볼피르.
12신의 계략에 당해 억겁 속에 봉인되었지만,
그로부터 66666년이 흘러 다시금 이 땅에 강림한다!
""응애!""
웰턴 백작의 갓 태어난 장남으로.
딥다크 매직 판타지 시작!",12,9.85,1,0,https://shared-comic.pstatic.net/thumb/webtoon/775141/thumbnail/thumbnail_IMAG06_e3aa8474-d024-46b9-8840-258c87170fa2.jpg,https://comic.naver.com/webtoon/list?titleId=775141&amp;weekday=wed
1141,150,엔딩 후 서브남을 주웠다,"황도톨,정서 / 정서",수,"스토리, 로맨스",네이버 웹툰,"빙의한 소설 속 나의 최애캐는 서브남이었다.
여주에게 버림받아 흑화한 츤데레는 어마무시한 까칠남이 되어 있었다는 것! 
나, 무사히 서브남을 주울 수 있을까?",0,9.98,1,0,https://shared-comic.pstatic.net/thumb/webtoon/761498/thumbnail/thumbnail_IMAG06_3c2df495-00fc-4b30-a23e-345a262407bd.jpg,https://comic.naver.com/webtoon/list?titleId=761498&amp;weekday=wed
1142,151,마른 가지에 바람처럼,달새울 / 화음,수,"스토리, 로맨스",네이버 웹툰,"남편을 잃고, 아이를 빼앗기고, 이제 생매장을 눈 앞에 둔 과부 리에타. 
그 곳에 ‘미친 폐황자’로 불리는 저주받은 땅, 악시아스 성의 대공. 킬리언이 나타났다.
그녀를 데려가겠다고 말하는 킬리언이 인사를 건넨다. “안녕, 요부”",12,9.98,1,0,https://shared-comic.pstatic.net/thumb/webtoon/748535/thumbnail/thumbnail_IMAG06_19e673ec-ba02-4637-8865-b181e605d996.jpg,https://comic.naver.com/webtoon/list?titleId=748535&amp;weekday=wed
1143,152,관종교장,좌승훈,수,"스토리, 개그",네이버 웹툰,전 재산을 가족 몰래 주식으로 날린 교장 정도만. 이제 은퇴까지 1년 밖에 남지 않았다. 가족에게 들키기 전에 잃은 돈을 메꾸려는 도만은 제자 홍삼과 함께 인터넷 방송을 시작하지만 예상과 달리 여러 사건에 휘말리게 되는데... 과연 노잼선생은 인기 BJ가 되어 빚을 청산할 수 있을까?!,12,9.84,1,0,https://shared-comic.pstatic.net/thumb/webtoon/774088/thumbnail/thumbnail_IMAG06_9bd727f5-6412-4512-90e5-95b2aa568ba2.jpg,https://comic.naver.com/webtoon/list?titleId=774088&amp;weekday=wed
1144,153,빌드업,911,수,"스토리, 스포츠",네이버 웹툰,"축구덕후지만 볼보이만 5년째?! 
빵셔틀 강마루의 열혈청춘 축구드라마",12,9.67,1,0,https://shared-comic.pstatic.net/thumb/webtoon/750826/thumbnail/thumbnail_IMAG06_a7ce9ddd-59df-4fc7-85d4-07361655626b.jpg,https://comic.naver.com/webtoon/list?titleId=750826&amp;weekday=wed
1145,154,원수를 사랑하라,정윤 / 태건,수,"스토리, 로맨스",네이버 웹툰,"고생 끝, 인생 리셋!.... 도 못했는데 과거를 들키다?!
늦깎이 대학생 배연희의 고군분투 캠퍼스 로맨스!",0,9.93,1,0,https://shared-comic.pstatic.net/thumb/webtoon/733079/thumbnail/thumbnail_IMAG06_154dcad6-831f-4efe-95f4-da4a60b9a0f7.jpg,https://comic.naver.com/webtoon/list?titleId=733079&amp;weekday=wed
1146,155,하렘의 남자들,"알파타르트,히어리 / 영빈",수,"스토리, 로맨스",네이버 웹툰,"""내 후궁들부터 들이기로 하였다. 한 다섯 정도.""
타리움 제국의 황녀, 라틸. 그녀의 첫사랑 하이신스는 황제가 되기 위해 본국 권력자의 딸과 결혼한다.
충격 받는 라틸. 하지만 그 충격이 가시기도 전에 황태녀가 되고,이복남매의 반란 세력에 맞서 황위를 지켜낸다.
그렇게 여황제가 된 라틸에게 대신들은 국서를 맞을 것을 제안하는데, 뭔가, 심기에 거슬린다.
'왜 여황제는 후궁을 못 들인다는 거지?'
""저도 최소 다섯 명은 후궁으로 두어야겠습니다. 제가 좋다면 하렘으로 들여보내세요,
보고 마음에 드는 사람을 국서로 삼을 것입니다."" 
전무후무한 여황제의 하렘으로, 치명적인 매력의 남자들이 모여든다!",12,9.93,1,0,https://shared-comic.pstatic.net/thumb/webtoon/760001/thumbnail/thumbnail_IMAG06_b46407a2-9147-44c9-bf4b-e3462a5fb8d0.jpg,https://comic.naver.com/webtoon/list?titleId=760001&amp;weekday=wed
1147,156,판타지 여동생!,유누,수,"스토리, 판타지",네이버 웹툰,"게임 초보 여동생의 RPG 도전기.
트롤 취급은 노노! 제가 사실 엄청난 히든 직업을 갖고 있거든요?",0,9.89,1,0,https://shared-comic.pstatic.net/thumb/webtoon/730425/thumbnail/thumbnail_IMAG06_32ea3e33-c91e-4b48-91f6-f788fb71648c.jpg,https://comic.naver.com/webtoon/list?titleId=730425&amp;weekday=wed
1148,157,격기3반,이학,수,"스토리, 스포츠",네이버 웹툰,"한국이 세계 격투기의 중심이 된 세상. 전국 탑 클래스 격투기 학생들만 모인 남일고에 약골 소년 주지태가 돌연 투입된다.
신체적 약점이 상쇄되는 무술 ‘주짓수’를 통해, 주지태는 격기반의 정점에 오를 수 있을 것인가…?",15,9.47,1,0,https://shared-comic.pstatic.net/thumb/webtoon/701535/thumbnail/thumbnail_IMAG06_3d26ef81-8afd-42fe-ae6a-1cfa7a585124.jpg,https://comic.naver.com/webtoon/list?titleId=701535&amp;weekday=wed
1149,158,언덕 위의 제임스,쿠당탕,수,"에피소드, 개그",네이버 웹툰,"제임스들이 펼치는 코믹 막장 에피소드!
지금 전세계의 제임스들이 몰려온다",0,9.92,1,0,https://shared-comic.pstatic.net/thumb/webtoon/671421/thumbnail/thumbnail_IMAG06_721a56be-3949-459c-bb82-1c0efd7bdd90.jpg,https://comic.naver.com/webtoon/list?titleId=671421&amp;weekday=wed
1150,159,괴물공작의 딸,한바다 / 찬란,수,"스토리, 판타지",네이버 웹툰,"세상과 단절되어 살아가던 나는 '괴물공작' 이라 불리는 아빠에게 거둬졌다.
어느 날, 아빠의 서재에서 이상한 책을 발견하는데…
이거 내용이 왜 이래? 내가 병 때문에 죽는다고? 그러면서 양녀를 들이고 잘해줘?
어차피 죽을 거라면 그전에는 뭘 해도 안 죽는다는 거잖아! 그렇다면, 정말 로티 맘대로 해버릴 거야!",0,8.39,1,0,https://shared-comic.pstatic.net/thumb/webtoon/765158/thumbnail/thumbnail_IMAG06_76bef3ba-4f5e-42d5-b5f6-b98d3d5356f6.jpg,https://comic.naver.com/webtoon/list?titleId=765158&amp;weekday=wed
1151,160,귀곡의 문,삼촌,수,"스토리, 드라마",네이버 웹툰,"귀신소굴로 유명한 삼도천동의 흉가,
평범한(?) 세입자들의 일상 개그",12,9.98,1,0,https://shared-comic.pstatic.net/thumb/webtoon/718020/thumbnail/thumbnail_IMAG06_34f243b5-a15e-48f0-bd0c-3696405dba32.jpg,https://comic.naver.com/webtoon/list?titleId=718020&amp;weekday=wed
1152,161,사상최강,황규영 / 이단아,수,"스토리, 판타지",네이버 웹툰,"‘천하 십대 고수’라고 불리는 자들. 인간의 한계를 뛰어넘은 그들은 서로를 견제하며 힘의 균형과 세상의 질서를 유지해왔다.
바로 ‘백도현’ 그가 나타나기 전까지는! 내공만으로 사상최강의 힘을 가진 남자 백도현의 시원한 한 방!",0,9.82,1,0,https://shared-comic.pstatic.net/thumb/webtoon/748536/thumbnail/thumbnail_IMAG06_3c3129ca-2a45-4fd7-a0cd-edb3fdc554e4.jpg,https://comic.naver.com/webtoon/list?titleId=748536&amp;weekday=wed
1153,162,오징어도 사랑이 되나요?,젤리피쉬 / 문댄스,수,"스토리, 로맨스",네이버 웹툰,"오징어와의 정략 결혼은 싫어! 인간 왕자님을 만날거야!
귀엽고 사랑스러운 울릉도의 오징어 공주는 이웃 나라 징징왕자와의 정략 결혼식을 거부하고 진정한 사랑을 찾아  스스로 미끼를 물어 오징어잡이 배를 탄다. 
인간 왕자와의 로맨스를 꿈꾸는 오징어 공주의 앞날은 과연...?
""오징어도 사랑이 되나요?""",0,9.83,1,0,https://shared-comic.pstatic.net/thumb/webtoon/770524/thumbnail/thumbnail_IMAG06_b6ffa30b-19e2-44f5-9a3e-85cc30ab2ef2.jpg,https://comic.naver.com/webtoon/list?titleId=770524&amp;weekday=wed
1154,163,조조코믹스,이동건,"수, 토","옴니버스, 로맨스",네이버 웹툰,"&lt;유미의 세포들&gt; 이동건 작가의 로맨스 시트콤 신작!
오늘 할 일을 내일로 미루는 평범한 직장인 은조,
그녀와는 다르게 외모와 매너 모든 것을 철저히 관리하는 직장동료 조완.
케미 좋은 두 사람의 다양하고 유쾌한 단편들이 여러분들을 기다리고 있습니다.
매주 수토! &lt;조조코믹스&gt;에서 단편만화 같은 일상을 즐겨보세요!",0,9.92,1,0,https://shared-comic.pstatic.net/thumb/webtoon/774862/thumbnail/thumbnail_IMAG06_fd618713-58b3-43f0-b4c3-a62740a3d885.jpg,https://comic.naver.com/webtoon/list?titleId=774862&amp;weekday=wed
1155,164,방탈출,십박,수,"스토리, 스릴러",네이버 웹툰,"갑자기 떨어진 이곳에서 목숨을 건 방탈출이 시작된다.
모든 상황을 의심해라! 아니면 죽음뿐이다...",15,9.94,1,0,https://shared-comic.pstatic.net/thumb/webtoon/733034/thumbnail/thumbnail_IMAG06_a8fdb5d0-4d2c-4465-b38d-c9cb1dd7e65c.jpg,https://comic.naver.com/webtoon/list?titleId=733034&amp;weekday=wed
1156,165,무용과 남학생,이호진,수,"스토리, 로맨스",네이버 웹툰,"어릴 적부터 소꿉친구 유연과 함께 발레를 배우던 시우는 어떤 사건으로 인해 발레를 그만두게 된다.
그러던 어느날  학교에  발레 하는 남학생 이준이 전학을 오고, 이준과 유연이 예술고등학교 무용과 입시를 준비하는 모습을 보면서 시우는 이준에게 묘한 경계심을 느끼게 되는데…
발레와 함께 피어나는 세사람의 알쏭달쏭 첫사랑 로맨스!",0,9.85,1,0,https://shared-comic.pstatic.net/thumb/webtoon/774853/thumbnail/thumbnail_IMAG06_a55555ee-ca28-4bd7-8f86-25347c902059.jpg,https://comic.naver.com/webtoon/list?titleId=774853&amp;weekday=wed
1157,166,마녀와 용의 신혼일기,"바리달, 뉴릉이 / 디망",수,"스토리, 로맨스",네이버 웹툰,"한 번의 실수로 인생을 꿰인 천재 마녀의 달콤살벌 신혼생활!
신입과의 하룻밤으로 모든 지위와 명성에 먹칠 당하게 된 천재 마법사 웬디. 
그런데 뭐..? 비밀을 지켜줄 테니 결혼해달라고...?!",15,9.96,1,0,https://shared-comic.pstatic.net/thumb/webtoon/755668/thumbnail/thumbnail_IMAG06_9024730d-a11f-4239-bd71-118be2f291ec.jpg,https://comic.naver.com/webtoon/list?titleId=755668&amp;weekday=wed
1158,167,새벽 두 시의 신데렐라,산차,수,"스토리, 로맨스",네이버 웹툰,"3년이나 사귄 연인인 서주원이 재벌가의 막내아들이란 것을 알게 된 지 두 달. 
하윤서는 주원과 헤어지는 대가로 돈을 받는다. 그리고 실제로 헤어지기 위해 정 떨어지는 행동들을 하지만, 
주원은 아랑곳하지 않고 윤서의 마음을 돌리려 노력하는데….",12,9.96,1,0,https://shared-comic.pstatic.net/thumb/webtoon/752533/thumbnail/thumbnail_IMAG06_81a5fc7e-2709-40fb-9531-0aadf54e7122.jpg,https://comic.naver.com/webtoon/list?titleId=752533&amp;weekday=wed
1159,168,반짝반짝 작은 눈,억수씨,수,"스토리, 판타지",네이버 웹툰,"신참 주민센터 공무원의 Vlog 같은 일상에 마법사가 나타나 전입신고를 요청하는 상황이 끼얹어진다면? 
평범한 듯 평범하지 않은 주민센터 공무원 윤의는 우연히 마법세계에서 피신 온 마법사와 마주치고 그가 지켜야하는 왕자의 알(용체)을 습득하게 되는데...
변덕쟁이 공무원과 고지식한 마법사가 펼치는 어불성설 로맨스!",0,9.9,1,0,https://shared-comic.pstatic.net/thumb/webtoon/772729/thumbnail/thumbnail_IMAG06_badd820d-1259-48cd-a01f-251e55e865c6.jpg,https://comic.naver.com/webtoon/list?titleId=772729&amp;weekday=wed
1160,169,아도나이,주동근,수,"스토리, 스릴러",네이버 웹툰,"외계인을 믿는 사이비종교 심층 취재기
이 종교, 알면 알수록 위험하다",15,9.93,1,0,https://shared-comic.pstatic.net/thumb/webtoon/725829/thumbnail/thumbnail_IMAG06_e610b788-2850-4497-9d99-4d1b8e303461.jpg,https://comic.naver.com/webtoon/list?titleId=725829&amp;weekday=wed
1161,170,이츠마인,럭스,수,"스토리, 스릴러",네이버 웹툰,"""어떻게 해야 널 지킬 수 있을까, 다정아?"" 
10년 뒤 다정이가 죽는다는 메시지를 본 요한, 
과연 그는 그녀를 지켜낼 수 있을 것인가.",15,9.97,1,0,https://shared-comic.pstatic.net/thumb/webtoon/710760/thumbnail/thumbnail_IMAG06_d2971783-7c20-495d-907b-e53fdc3cf78a.jpg,https://comic.naver.com/webtoon/list?titleId=710760&amp;weekday=wed
1162,171,로어 올림푸스,레이첼 스마이스,"수, 일","스토리, 로맨스",네이버 웹툰,"어디서도 본 적 없는 신화 이야기, 풋내기 여신 페르세포네와 지하세계의 왕 하데스의 현대판 로맨스 판타지!
글로벌 No.1 인기작 'Lore Olympus'를 한국어 버전으로 감상하세요.",15,9.91,1,0,https://shared-comic.pstatic.net/thumb/webtoon/750558/thumbnail/thumbnail_IMAG06_ff74b387-a953-4356-a4a0-c45abb88384c.jpg,https://comic.naver.com/webtoon/list?titleId=750558&amp;weekday=wed
1163,172,반귀,세정,수,"스토리, 로맨스",네이버 웹툰,"평범한 하연과 기묘한 후안의 평범하지 않은 캠퍼스 라이프!
귀신이 보이진 않아도 그들의 기운을 느낄 수 있는 하연은 어느 날 귀신인지 아닌지 헷갈리는 후안을 만나게 된다.
그 이후로, 정체 모를 기괴한 존재들이 자꾸만 하연의 주변을 맴돌게 되는데...&lt;귀각시&gt; 세정 작가의 신작!",12,9.95,1,0,https://shared-comic.pstatic.net/thumb/webtoon/760002/thumbnail/thumbnail_IMAG06_e92657f6-9097-4f88-b341-497fa4de1281.jpg,https://comic.naver.com/webtoon/list?titleId=760002&amp;weekday=wed
1164,173,얼굴천재,지에이,수,"스토리, 드라마",네이버 웹툰,"어느 날 갑자기 게임 캐릭터로 변신하는 능력이 생겼다! 
그 스킬과, 그 모습이 모두 내 것이다.
나는 이제 언제든 ""얼굴천재""가 된다!",12,9.84,1,0,https://shared-comic.pstatic.net/thumb/webtoon/735979/thumbnail/thumbnail_IMAG06_fe43bb94-224c-4189-9265-d2da56100b52.jpg,https://comic.naver.com/webtoon/list?titleId=735979&amp;weekday=wed
1165,174,범이올시다!,해,수,"에피소드, 일상",네이버 웹툰,"호통 치는 영희 할머니와 무뚝뚝 소녀 방실이 앞에 나타난 
정체불명의 고양...아니 호랑이?",0,9.98,1,0,https://shared-comic.pstatic.net/thumb/webtoon/745589/thumbnail/thumbnail_IMAG06_a4695fe7-804d-42b1-9467-01e43955b64f.jpg,https://comic.naver.com/webtoon/list?titleId=745589&amp;weekday=wed
1166,175,칼부림,고일권,수,"스토리, 시대극",네이버 웹툰,"뜻을 품고 한을 품은 팔도의 자제들아 서슬퍼런 칼날 내보이라!
이괄의 난을 배경으로 펼쳐지는 함이의 복수와 성장",12,9.9,1,0,https://shared-comic.pstatic.net/thumb/webtoon/602916/thumbnail/thumbnail_IMAG06_cd40fcb7-fcd1-4f26-a5f2-22618067f6a0.jpg,https://comic.naver.com/webtoon/list?titleId=602916&amp;weekday=wed
1167,176,럭키언럭키,가천가,수,"스토리, 판타지",네이버 웹툰,"평범하게 살아왔던 안녹희, 알고보니 행운 초능력자였다?!
어쩌다보니 초능력학교 전교 1등까지 해버리고...
다시 평범해지고픈 안녹희의 고군분투 고교생활",0,9.95,1,0,https://shared-comic.pstatic.net/thumb/webtoon/736281/thumbnail/thumbnail_IMAG06_2b054db2-a7fa-4f61-bba1-1c6884eeb2af.jpg,https://comic.naver.com/webtoon/list?titleId=736281&amp;weekday=wed
1168,177,사랑과 평강의 온달!,한기주 / 일,수,"스토리, 로맨스",네이버 웹툰,"교육직 공무원인 박사랑, 그녀에게는 평생을 바쳐서라도 꼭 해야 하는 일이 있다. 바로 사촌 동생인 평강이(전생 평강공주)의 진짜 인연 '온달'을 찾아주는 것! 
그런데 온달을 찾고, 연을 맺어주느라 바쁜 사랑 앞에 미남들이 꼬이는데?!",12,9.96,1,0,https://shared-comic.pstatic.net/thumb/webtoon/773187/thumbnail/thumbnail_IMAG06_8d710191-d60d-4fb9-813e-20e44df13ec2.jpg,https://comic.naver.com/webtoon/list?titleId=773187&amp;weekday=wed
1169,178,속보입니다,밀카 / Z6,수,"스토리, 로맨스",네이버 웹툰,"평범한 대학생 '예슬'은 대한민국에서 모르면 간첩이라는
최연소 메인뉴스 아나운서 '김민준'을 만나기 위해 방송국 카페에서 아르바이트를 시작한다.
그러나 민준은 기대했던 것과는 다르게 너무 차갑기만 하고…
제가 얼마나 오랜 기간 좋아했는데, 왜 이렇게 차갑게 구시는 거예요?",0,9.84,1,0,https://shared-comic.pstatic.net/thumb/webtoon/755758/thumbnail/thumbnail_IMAG06_fe650064-e0e8-442f-896c-1d6f58b80c22.jpg,https://comic.naver.com/webtoon/list?titleId=755758&amp;weekday=wed
1170,179,구주,준치 / 조9,수,"스토리, 드라마",네이버 웹툰,"구원을 바라는 뱀파이어와, 그녀를 둘러싼 두 여자의 어긋난 관계. 뱀파이어인 원은 대학에서 선배 주이를 만난 후 새로운 감정을 배우고, 평범한 삶을 꿈꾼다. 원에게 집착하는 소꿉친구 세연은 둘을 갈라놓으려 하지만, 세연이 거슬렸던 주이는 일부러 원에게 접근한다. 세 사람의 관계는 파국으로 치닫는데….",15,9.8,1,0,https://shared-comic.pstatic.net/thumb/webtoon/770844/thumbnail/thumbnail_IMAG06_00b46552-3538-4212-b254-8608ff1dd552.jpg,https://comic.naver.com/webtoon/list?titleId=770844&amp;weekday=wed
1171,180,수요웹툰의 나강림,이경민 / 송준혁,수,"스토리, 판타지",네이버 웹툰,"평소 웹툰을 즐겨보는 고등학생 나강림. 
어느날 그의 눈앞에 웹툰 속에서 봤던 여주인공이 나타나는 기이한 일이 펼쳐진다.
심지어 웹툰에서와 똑같은 사건이 그녀를 위기로 몰아넣는데,
문제는 그 사건으로부터 그녀를 구해줄 주인공이 현실에는 없다는 것!
결국 나강림은 주인공 역할을 대신하여 그녀들을 구하기 위해 시간을 반복하며 구른다.",15,9.52,1,0,https://shared-comic.pstatic.net/thumb/webtoon/771718/thumbnail/thumbnail_IMAG06_0b93ce68-4a8e-4d95-bad7-09ad47865856.jpg,https://comic.naver.com/webtoon/list?titleId=771718&amp;weekday=wed
1172,181,나의 계절,박수민,수,"스토리, 로맨스",네이버 웹툰,"승재는 친구의 부탁에 못 이겨 같은 반 봄이와 장난삼아 사귀게 된다.
시간이 갈수록 예상치 못 한 봄이의 매력에 승재는 끌림을 느끼면서도
마지막 순간에 떠 밀리듯 최악의 선택을 하고 마는데...
승재는 이 때만 해도 알지 못했다. 봄을 시작으로 잊지 못할 계절들을 보내게 될 줄은.",15,9.69,1,0,https://shared-comic.pstatic.net/thumb/webtoon/774039/thumbnail/thumbnail_IMAG06_91ba3504-90cc-47ab-bc58-bb30d7d45af2.jpg,https://comic.naver.com/webtoon/list?titleId=774039&amp;weekday=wed
1173,182,웰컴 온보드,다니,수,"스토리, 로맨스",네이버 웹툰,"간절하게 꿈꿔온 승무원 합격! 아란은 비행기에서 기절한 자신을 돌봐줬던 승무원 채현에게 반해 에어윙크에 입사한다.
입사하면 채현 선배와 비행을 해볼 수 있을까? 환상을 가지고 들어왔지만 이 직업은 그렇게 아름답지만은 않다.
신입 승무원 아란, 입사동기 선우, 선배 채현이 함께하는 비행과 사랑 이야기!",0,9.37,1,0,https://shared-comic.pstatic.net/thumb/webtoon/758670/thumbnail/thumbnail_IMAG06_f5534021-41b5-4a8d-a47c-2a482b3bbaf4.jpg,https://comic.naver.com/webtoon/list?titleId=758670&amp;weekday=wed
1174,183,뱀은 꽃을 먹는가,소나음,수,"스토리, 로맨스",네이버 웹툰,"폭군 황제가 다스리는 황궁.?
천재 악사 하랑은 황제가 끔찍이도 아끼는 꽃, 애화의 전속 악사로 부름 받는다.
그러나 황제는 하랑이 애화의 얼굴을 보는 것조차 용납할 수 없었다.

""이제는 아무 것도 담아서는 안 되는 저 눈을… 뽑아라!""

하랑은 저열한 욕망으로 자신의 눈을 멀게 만든, 황제와 애화에게 복수를 결심하는데…….",12,9.74,1,0,https://shared-comic.pstatic.net/thumb/webtoon/763851/thumbnail/thumbnail_IMAG06_655728b0-109f-4f26-aa82-7af7f0b0b972.jpg,https://comic.naver.com/webtoon/list?titleId=763851&amp;weekday=wed
1175,184,스캔들,"달콤J,티바 / 도그",수,"스토리, 로맨스",네이버 웹툰,"당대 최고 인기 여배우의 스캔들의 주인공이 내 남편이라면?
남편의 불륜으로 신혼이 파탄난 지우는 기자생활을 접고 미국으로 떠나게 되고, 
전 남편이 거절할 수 없는 제안을 건네온다.",12,9.88,1,0,https://shared-comic.pstatic.net/thumb/webtoon/751642/thumbnail/thumbnail_IMAG06_21b06c78-61af-48d8-be8b-d19d7f9402bf.jpg,https://comic.naver.com/webtoon/list?titleId=751642&amp;weekday=wed
1176,185,기억흔적,브라보 장,수,"스토리, 스릴러",네이버 웹툰,"사랑하는 가족을 잃은 남자.
가족을 살리기 위한 처절한 시간 여행이 시작된다.",15,9.89,1,0,https://shared-comic.pstatic.net/thumb/webtoon/739113/thumbnail/thumbnail_IMAG06_efd31be8-b6f0-4100-aaf6-12c66530f09d.jpg,https://comic.naver.com/webtoon/list?titleId=739113&amp;weekday=wed
1177,186,신선비,이서현,수,"스토리, 로맨스",네이버 웹툰,꽃미남 뱀신랑과 얽혀버린 운명. 로맨스릴러 시즌2 시작!,0,9.91,1,0,https://shared-comic.pstatic.net/thumb/webtoon/735254/thumbnail/thumbnail_IMAG06_a2fd1312-f034-4aac-bdb5-3946b721c47c.jpg,https://comic.naver.com/webtoon/list?titleId=735254&amp;weekday=wed
1178,187,해귀,알파A,수,"스토리, 판타지",네이버 웹툰,"어느 날 갑자기 한마을을 덮친 해귀들. 
해귀에게 엄마를 잃고 살 길을 찾아 마을 밖으로 도망친 주인공 한천은 
엄마가 사실 해귀에게 죽은 것이 아니고 먹이로 납치당했다는 사실을 알게 된다. 
한천은 끌려간 엄마를 구하기 위해 위험한 길을 떠나게 되는데...",12,9.84,1,0,https://shared-comic.pstatic.net/thumb/webtoon/762786/thumbnail/thumbnail_IMAG06_49de5c3a-ffcd-4ab0-bc47-8663a6aadb1a.jpg,https://comic.naver.com/webtoon/list?titleId=762786&amp;weekday=wed
